,Count
The operator disengaged the system manually to remain in the operational design domain. This was accomplished by pressing the brake pedal to reduce the velocity of the vehicle.,4
The operator disengaged the system manually to remain in the operational design domain. The driver performed a steering manouver to correct the trajectory of the vehicle.,3
The system disengaged because of an error with the fusion component. The system asked the operator to take control of the vehicle.,3
Invalid control unit operation.Test driver disengaged due to planning system choosing a trajectory that is too fast and aggressive.   ,26
The operator disengaged the system manually to remain in the operational design domain. This was achieved by pressing the accelerator pedal to increase velocity of the vehicle.,2
